{
  "meeting_id": "demo-mixed-001",
  "audio_path": "/data/audio/demo-mixed-001.wav",
  "meeting_datetime": "2026-09-23T10:00:00+05:00",
  "timezone": "Asia/Qyzylorda",
  "participants": [
    {
      "id": "p1",
      "name": "Марсель",
      "speaker_ids": []
    },
    {
      "id": "p2",
      "name": "Айжан",
      "speaker_ids": []
    }
  ]
}
